{
  "type": "WebScience.pageNav",
  "userId": "7a367510-5fcc-4313-b70f-117fa3e2f027",
  "visitId": "4caccb6e-7ae8-42e8-bd3c-c6253713801a",
  "url": "https://www.yourbigsky.com/",
  "referrer": "",
  "pageVisitStartTime": 1623271436192,
  "pageVisitStopTime": 1623271449198,
  "attentionDuration": 12520,
  "audioDuration": 0,
  "attentionAndAudioDuration": 0,
  "maxRelativeScrollDepth": 0.21491891891891893
}